sentence_id,dialect,sentence,tokens,pos_tags,token_count
46,Doha,بقول لها تكلمك اول ما ترجع.,بقول لها تكلمك اول ما ترجع .,verb prep verb adj_num conj_sub verb punc,7
50,Doha,بغيت سكر وكريمة في القهوة؟,بغيت سكر وكريمة في القهوة ؟,verb noun noun prep noun punc,6
51,Doha,هي متعورة واجد.,هي متعورة واجد .,pron noun adj punc,4
52,Doha,بغيت ولاعة.,بغيت ولاعة .,verb noun punc,3
53,Doha,في تجهيزات للمؤتمرات في هالفندق؟,في تجهيزات للمؤتمرات في هالفندق ؟,prep noun noun prep noun punc,6
56,Doha,معليه ناكل وجبة خفيفة؟,معليه ناكل وجبة خفيفة ؟,interj verb noun adj punc,5
57,Doha,انا اتصل من المطار، بكون عندك على الساعة اربع.,انا اتصل من المطار ، بكون عندك على الساعة اربع .,pron verb prep noun punc verb prep prep noun noun_num punc,11
62,Doha,وين اقدر احول لشيكاغو؟,وين اقدر احول لشيكاغو ؟,adv_interrog verb verb noun_prop punc,5
63,Doha,كم يكلف ارسال رسالة مسجلة لفرنسا؟,كم يكلف ارسال رسالة مسجلة لفرنسا ؟,adv_interrog verb noun noun adj noun_prop punc,7
64,Doha,ممكن تصرف لي قيمة جيكي بو ميتين دولار كاش؟,ممكن تصرف لي قيمة جيكي بو ميتين دولار كاش ؟,adj verb prep noun noun prep noun_num noun noun punc,10
68,Doha,وايد فرق لما تسوق على الجهة اليمين.,وايد فرق لما تسوق على الجهة اليمين .,adj noun conj_sub verb prep noun noun punc,8
69,Doha,الممثل واجد عجيب.,الممثل واجد عجيب .,noun adj adj punc,4
72,Doha,وين قسم الكتب الواقعية؟,وين قسم الكتب الواقعية ؟,adv_interrog noun noun adj punc,5
74,Doha,اذا المفروض يصير، اتصل فيني.,اذا المفروض يصير ، اتصل فيني .,conj_sub noun verb punc verb prep punc,7
78,Doha,ممكن تغير كرسيي؟,ممكن تغير كرسيي ؟,adj verb noun punc,4
79,Doha,في ضمان؟,في ضمان ؟,prep noun punc,3
83,Doha,مسامحة، بحط بالي على الكلب.,مسامحة ، بحط بالي على الكلب .,noun punc verb noun prep noun punc,7
84,Doha,"بغيت تذكرتين حق ""كاتس"" هالخميس.","بغيت تذكرتين حق "" كاتس "" هالخميس .",verb noun prep punc noun_prop punc noun_num punc,8
86,Doha,وين الكوفي شوب؟,وين الكوفي شوب ؟,adv_interrog noun noun punc,4
87,Doha,بغيت فانلة يهال.,بغيت فانلة يهال .,verb noun noun punc,4
89,Doha,شسمك مرة ثانية؟,شسمك مرة ثانية ؟,noun noun adj punc,4
90,Doha,سيد براون موجود؟,سيد براون موجود ؟,noun noun_prop adj punc,4
91,Doha,اوكي. يكلف خمسة وثمانين سنت بالبريد العادي وثلاث دولارات بالضبط زيادة حق التسليم الخاص.,اوكي . يكلف خمسة وثمانين سنت بالبريد العادي وثلاث دولارات بالضبط زيادة حق التسليم الخاص .,noun punc verb noun_num noun_num noun noun adj noun_num noun adv noun prep noun adj punc,16
92,Doha,ممكن أأجر طراد حق يوم واحد؟,ممكن أأجر طراد حق يوم واحد ؟,adj verb noun prep noun noun_num punc,7
93,Doha,في أي كشك يصير احجز؟,في أي كشك يصير احجز ؟,prep pron_interrog noun verb verb punc,6
94,Doha,شنو ذي؟,شنو ذي ؟,part_interrog pron_dem punc,3
96,Doha,ممكن تقول لي شلون اروح الأوبرا؟,ممكن تقول لي شلون اروح الأوبرا ؟,adj verb prep adv_interrog verb noun_prop punc,7
97,Doha,حبيبي مو جنك كنت واجد سكران البارحة؟,حبيبي مو جنك كنت واجد سكران البارحة ؟,noun part_neg verb verb adv adj noun punc,8
98,Doha,اتبع تعليمات موظفينا لو سمحت.,اتبع تعليمات موظفينا لو سمحت .,verb noun noun conj_sub verb punc,6
100,Doha,في مركز تجاري قريب من هني؟,في مركز تجاري قريب من هني ؟,part noun adj adj prep adv punc,7
102,Doha,فل، لو سمحت.,فل ، لو سمحت .,verb punc conj_sub verb punc,5
103,Doha,في غرفة أرخص؟,في غرفة أرخص ؟,prep noun adj punc,4
104,Doha,افضل سيارة اوتوماتيك.,افضل سيارة اوتوماتيك .,verb noun adj punc,4
105,Doha,بسكن في سكن جامعة هارفارد.,بسكن في سكن جامعة هارفارد .,verb prep noun noun noun_prop punc,6
106,Doha,شنو السعر اليوم؟,شنو السعر اليوم ؟,pron_interrog noun noun punc,4
108,Doha,فيني ربو مزمن.,فيني ربو مزمن .,prep noun adj punc,4
109,Doha,عندي ثلاثة آلاف دولار تقريباً.,عندي ثلاثة آلاف دولار تقريباً .,prep noun_num noun_num noun adv punc,6
111,Doha,اوكي. الطبق ايي مع بطاطس او أرز بيلاف. شنو تفضل؟,اوكي . الطبق ايي مع بطاطس او أرز بيلاف . شنو تفضل ؟,interj punc noun verb prep noun conj noun noun punc part_interrog verb punc,13
112,Doha,شلون اروح هالمكان؟,شلون اروح هالمكان ؟,adv_interrog verb noun punc,4
113,Doha,شنوع القصة؟,شنوع القصة ؟,adv_interrog noun punc,3
115,Doha,ثلاث مرات.,ثلاث مرات .,noun_num noun punc,3
116,Doha,اي كشك يبيع طوابع؟,اي كشك يبيع طوابع ؟,adv_interrog noun verb noun punc,5
117,Doha,هاجمني وعقب راح في فان ابيض.,هاجمني وعقب راح في فان ابيض .,verb prep verb prep noun adj punc,7
119,Doha,اوكي. لو سمحت خل هالبطاقة عندك وطلعها لما تجي تستلمه.,اوكي . لو سمحت خل هالبطاقة عندك وطلعها لما تجي تستلمه .,interj punc conj_sub verb verb noun prep verb conj_sub verb verb punc,12
120,Doha,لو كنت مكانك جان بشتري هذي.,لو كنت مكانك جان بشتري هذي .,conj_sub verb noun part verb pron_dem punc,7
122,Doha,ميتين دولار. كاش او كردت كارد؟,ميتين دولار . كاش او كردت كارد ؟,noun noun punc noun conj noun noun punc,8
125,Doha,شكثر تاخذ مدة الرحلة على هالبركة؟,شكثر تاخذ مدة الرحلة على هالبركة ؟,adv_interrog verb noun noun prep noun punc,7
128,Doha,في اكل لازم اتجنبه وانا اخذ هالدوا؟,في اكل لازم اتجنبه وانا اخذ هالدوا ؟,part noun adj verb pron verb noun punc,8
129,Doha,بتكون في اي صعوبات مع الجمارك؟,بتكون في اي صعوبات مع الجمارك ؟,verb prep noun_quant noun prep noun punc,7
130,Doha,عندك جواتي رسمية حق الرجول العريضة؟,عندك جواتي رسمية حق الرجول العريضة ؟,prep noun adj prep noun adj punc,7
131,Doha,بغيت واين احمر؟,بغيت واين احمر ؟,verb noun adj punc,4
133,Doha,خبرني لين وصلنا المتحف.,خبرني لين وصلنا المتحف .,verb conj_sub verb noun punc,5
134,Doha,يروح هالباص لفندق الشيراتون؟,يروح هالباص لفندق الشيراتون ؟,verb noun noun noun_prop punc,5
135,Doha,كم يصير؟,كم يصير ؟,part_interrog verb punc,3
136,Doha,شوي حر. عادي ابطل الدريشة؟,شوي حر . عادي ابطل الدريشة ؟,noun adj punc adj verb noun punc,7
138,Doha,بس شور اوكي.,بس شور اوكي .,adv noun_prop noun punc,4
139,Doha,عيوني حمر.,عيوني حمر .,noun adj punc,3
140,Doha,لا. بغيت غرفة مزدوجة بس حق استخدام فردي؟ عندنا وحدة.,لا . بغيت غرفة مزدوجة بس حق استخدام فردي ؟ عندنا وحدة .,part_neg punc verb noun adj conj prep noun adj punc prep adj punc,13
142,Doha,ماقدر اضمن لك، بس بنحاول.,ماقدر اضمن لك ، بس بنحاول .,verb verb prep punc conj verb punc,7
143,Doha,ابغي كيرلي ضيق، لو سمحت.,ابغي كيرلي ضيق ، لو سمحت .,verb noun adj punc conj_sub verb punc,7
144,Doha,تقدر تشوف البحر تحت من بعيد.,تقدر تشوف البحر تحت من بعيد .,verb verb noun prep prep adj punc,7
145,Doha,هي تبغي بير.,هي تبغي بير .,pron verb noun punc,4
146,Doha,تحتاج عملية.,تحتاج عملية .,verb noun punc,3
147,Doha,بيض اكثر، لو سمحت.,بيض اكثر ، لو سمحت .,noun noun_quant punc conj_sub verb punc,6
148,Doha,وين محطة الباص حق سنترال بارك؟,وين محطة الباص حق سنترال بارك ؟,adv_interrog noun noun prep noun noun punc,7
149,Doha,تكاسي؟,تكاسي ؟,noun punc,2
151,Doha,تفضل مفتاحك اخوي. غرفة خمسة آلاف وستمية واثنعش.,تفضل مفتاحك اخوي . غرفة خمسة آلاف وستمية واثنعش .,verb noun noun punc noun noun_num noun_num noun_num noun_num punc,10
153,Doha,عجبني قميصك.,عجبني قميصك .,verb noun punc,3
154,Doha,تفضل.,تفضل .,verb punc,2
155,Doha,وصلنا. هذي فندقك.,وصلنا . هذي فندقك .,verb punc pron_dem noun punc,5
156,Doha,متى تبتدي مباراة كرة السلة؟,متى تبتدي مباراة كرة السلة ؟,adv_interrog verb noun noun noun punc,6
157,Doha,صباح الخير. شلونك؟,صباح الخير . شلونك ؟,noun noun punc adv_interrog punc,5
158,Doha,مسامحة بس لازم اشوف شي يثبت الهوية.,مسامحة بس لازم اشوف شي يثبت الهوية .,noun conj verb verb noun verb noun punc,8
159,Doha,شرايك؟,شرايك ؟,adv_interrog punc,2
160,Doha,أكيد. بغيت قهوتك مع العشا او بعده؟,أكيد . بغيت قهوتك مع العشا او بعده ؟,adj punc verb noun prep noun conj noun punc,9
161,Doha,بسافر على طيارة اثنعش لي طوكيو.,بسافر على طيارة اثنعش لي طوكيو .,verb prep noun noun_num prep noun_prop punc,7
162,Doha,بغيت اسوي مكالمة خارجية، لو سمحت.,بغيت اسوي مكالمة خارجية ، لو سمحت .,verb verb noun adj punc conj_sub verb punc,8
0,Rabat,كاين في اللاخر ديال هاد القاعة. انجيب ليك شويا دابا. و إلا حتاجيتي شي حاجا اخرى، قولها ليا.,كاين في اللاخر ديال هاد القاعة . انجيب ليك شويا دابا . و إلا حتاجيتي شي حاجا اخرى ، قولها ليا .,verb prep noun prep part noun punc verb pron noun adv punc conj part_restrict verb noun_quant noun adj punc verb pron punc,22
2,Rabat,واش كا دير التعديلات؟,واش كا دير التعديلات ؟,part_interrog part verb noun punc,5
4,Rabat,بغينا ناخدو طابلة حدا الشرجم.,بغينا ناخدو طابلة حدا الشرجم .,verb verb noun noun noun punc,6
5,Rabat,راه تما، مقابل مكتب استعلامات السياح بالضبط.,راه تما ، مقابل مكتب استعلامات السياح بالضبط .,part adv punc prep noun noun noun adv punc,9
9,Rabat,ما عمري سمعت هاد العنوان هنايا.,ما عمري سمعت هاد العنوان هنايا .,part_neg noun verb pron_dem noun adv punc,7
11,Rabat,سير نيشان حتا تشوف صيدلية.,سير نيشان حتا تشوف صيدلية .,verb adv conj_sub verb noun punc,6
12,Rabat,شنو هو اجدد لون هاد الموسم؟,شنو هو اجدد لون هاد الموسم ؟,adv_interrog pron adj_comp noun pron_dem noun punc,7
14,Rabat,في الحالة ديالي، راه غالبا على الخدمة، قليل للمتعة.,في الحالة ديالي ، راه غالبا على الخدمة ، قليل للمتعة .,prep noun noun punc part adv prep noun punc adv noun punc,12
15,Rabat,غادي نبقا يومين.,غادي نبقا يومين .,verb_pseudo verb noun punc,4
16,Rabat,بغيت بيرمانونت مجهد.,بغيت بيرمانونت مجهد .,verb noun adj punc,4
17,Rabat,بغيت نحجز جوج غرف ثنائية.,بغيت نحجز جوج غرف ثنائية .,verb verb noun_num noun adj punc,6
18,Rabat,ما بغيتهوش منزوع.,ما بغيتهوش منزوع .,part_neg verb adj punc,4
19,Rabat,واش كا يحبس هاد الطوبيس في شارع ستونر؟,واش كا يحبس هاد الطوبيس في شارع ستونر ؟,part_interrog part verb pron_dem noun prep noun noun_prop punc,9
24,Rabat,حل فمك مزيان عافاك.,حل فمك مزيان عافاك .,verb noun adj interj punc,5
26,Rabat,شحال كا يدير الفطور؟,شحال كا يدير الفطور ؟,adv_interrog part verb noun punc,5
27,Rabat,كيفاش نقدر نعاونك؟,كيفاش نقدر نعاونك ؟,adv_interrog verb verb punc,4
29,Rabat,يالاه ناخدو شي حاجة ناكلوها.,يالاه ناخدو شي حاجة ناكلوها .,interj verb noun prep verb punc,6
30,Rabat,مع القنت التالت دور على ليسر.,مع القنت التالت دور على ليسر .,prep noun adj verb prep noun punc,7
31,Rabat,واخا تغسل هاد لحوايج؟,واخا تغسل هاد لحوايج ؟,part verb pron_dem noun punc,5
37,Rabat,غادي نعطيك رقم التلفون و العنوان ديالو.,غادي نعطيك رقم التلفون و العنوان ديالو .,verb_pseudo verb noun noun conj noun noun punc,8
38,Rabat,خلصت الماكلة و الأوطيل مسبقاً.,خلصت الماكلة و الأوطيل مسبقاً .,verb noun conj noun adv punc,6
40,Rabat,كا نقلب على شي مطعم زوين، وهادئ من نوع الشوا. واخا توريهم في هاد الخريطة؟,كا نقلب على شي مطعم زوين ، وهادئ من نوع الشوا . واخا توريهم في هاد الخريطة ؟,part verb prep part noun adj punc adj prep noun noun punc interj verb prep pron_dem noun punc,18
42,Rabat,الا هرسته، خاصك تشريه.,الا هرسته ، خاصك تشريه .,pron_rel verb punc verb verb punc,6
46,Rabat,غادي نقول ليها تعيط ليك منين ترجع.,غادي نقول ليها تعيط ليك منين ترجع .,verb_pseudo verb prep verb prep conj_sub verb punc,8
50,Rabat,واش تبغي لاكريم و السكر في القهوة ديالك؟,واش تبغي لاكريم و السكر في القهوة ديالك ؟,part_interrog verb noun conj noun prep noun noun punc,9
51,Rabat,راها مضروبة بزاف.,راها مضروبة بزاف .,part noun adv punc,4
52,Rabat,بغيت بريكا.,بغيت بريكا .,verb noun punc,3
53,Rabat,واش هاد الأوطيل فيه تجهيزات ديال المؤتمرات؟,واش هاد الأوطيل فيه تجهيزات ديال المؤتمرات ؟,part_interrog pron_dem noun prep noun prep noun punc,8
56,Rabat,واش ماشي مشكل ناخدو غير وجبة خفيفة؟,واش ماشي مشكل ناخدو غير وجبة خفيفة ؟,part_interrog part_neg noun verb adv noun adj punc,8
57,Rabat,كا نعيط من المطار. غادي نكون تما معا الربعة تقريباً.,كا نعيط من المطار . غادي نكون تما معا الربعة تقريباً .,part verb prep noun punc verb_pseudo verb adv prep noun adv punc,12
62,Rabat,منين نحول لشيكاغو؟,منين نحول لشيكاغو ؟,adv_interrog verb noun_prop punc,4
63,Rabat,بشحال نقدر نصيفط رسالة مسجلة لفرنسا؟,بشحال نقدر نصيفط رسالة مسجلة لفرنسا ؟,adv_interrog verb verb noun adj noun_prop punc,7
64,Rabat,تقدر تخلص الشيك ديالي ديال ميتين دولار؟,تقدر تخلص الشيك ديالي ديال ميتين دولار ؟,verb verb noun noun prep noun_num noun punc,8
68,Rabat,السياقة مختالفة بزاف من الجنب ليمن ديال الزنقة.,السياقة مختالفة بزاف من الجنب ليمن ديال الزنقة .,noun adj adv prep noun adj prep noun punc,9
69,Rabat,الممثل واعر بزاف.,الممثل واعر بزاف .,noun adj adv punc,4
72,Rabat,فين هو القسم ديال الكتاب الواقعي؟,فين هو القسم ديال الكتاب الواقعي ؟,adv_interrog pron noun prep noun adj punc,7
74,Rabat,إلا خصو يبان، عيط ليا عفاك.,إلا خصو يبان ، عيط ليا عفاك .,part_restrict verb verb punc verb prep interj punc,8
78,Rabat,تقدر تبدل ليا البلاصة عفاك؟,تقدر تبدل ليا البلاصة عفاك ؟,verb verb prep noun interj punc,6
79,Rabat,واش كاين شي ضمانة؟,واش كاين شي ضمانة ؟,part_interrog verb noun noun punc,5
83,Rabat,سمح ليا، غادي نتهلا في الكلب.,سمح ليا ، غادي نتهلا في الكلب .,verb prep punc verb_pseudo verb prep noun punc,8
84,Rabat,بغيت جوج وراق ل''كاتس ''، لهاد الخميس.,بغيت جوج وراق ل ' ' كاتس ' ' ، لهاد الخميس .,verb noun_num noun prep punc punc noun_prop punc punc punc pron_dem noun punc,13
86,Rabat,فين القهوة؟,فين القهوة ؟,adv_interrog noun punc,3
87,Rabat,بغيت تريكو ديال الدراري الصغار.,بغيت تريكو ديال الدراري الصغار .,verb noun prep noun adj punc,6
89,Rabat,شنو سميتك مرة خرا؟,شنو سميتك مرة خرا ؟,part_interrog noun noun adj punc,5
90,Rabat,واش كاين مستر براون؟,واش كاين مستر براون ؟,part_interrog verb noun noun_prop punc,5
91,Rabat,واخا. كايدير خمسة و تمانين دولار للبريد العادي و تلاتة دولار بالضبط زيادة للتوصيل الخاص.,واخا . كايدير خمسة و تمانين دولار للبريد العادي و تلاتة دولار بالضبط زيادة للتوصيل الخاص .,part punc verb noun_num conj noun_num noun noun adj conj noun_num noun adv noun noun adj punc,17
92,Rabat,نقدر نكري باطو لنهار؟,نقدر نكري باطو لنهار ؟,verb verb noun noun punc,5
93,Rabat,في إينا شرجم نقدر نحجز؟,في إينا شرجم نقدر نحجز ؟,prep pron_interrog noun verb verb punc,6
94,Rabat,شنو هوا هاذا؟,شنو هوا هاذا ؟,part_interrog pron pron_dem punc,4
96,Rabat,تقدر تقول ليا منين نمشي للأوبيرا؟,تقدر تقول ليا منين نمشي للأوبيرا ؟,verb verb prep part_interrog verb noun_prop punc,7
97,Rabat,ماكنتيش شويا سكران لبارح، أحبيبي؟,ماكنتيش شويا سكران لبارح ، أحبيبي ؟,verb noun adj noun punc noun punc,7
98,Rabat,عفاك تبع التعليمات ديال الطاقم ديالنا.,عفاك تبع التعليمات ديال الطاقم ديالنا .,interj verb noun prep noun noun punc,7
100,Rabat,واش كاين شي متجر شامل قريب من هنا؟,واش كاين شي متجر شامل قريب من هنا ؟,part_interrog verb noun noun adj adj prep adv punc,9
102,Rabat,عمر، عافاك.,عمر ، عافاك .,noun_prop punc interj punc,4
103,Rabat,واش كاينا شي غرفة أرخص؟,واش كاينا شي غرفة أرخص ؟,part_interrog verb noun noun adj_comp punc,6
104,Rabat,كا نفضل سيارة اوطوماتيك.,كا نفضل سيارة اوطوماتيك .,part_fut verb noun adj punc,5
105,Rabat,غادي نبقا في السكن الداخلي ديال جامعة هارفرد.,غادي نبقا في السكن الداخلي ديال جامعة هارفرد .,verb_pseudo verb prep noun adj prep noun noun_prop punc,9
106,Rabat,شنو هوا المعدل ديال هاد النهار؟,شنو هوا المعدل ديال هاد النهار ؟,part_interrog pron noun prep pron_dem noun punc,7
108,Rabat,كا نعاني من مرض الضيقة المزمنة.,كا نعاني من مرض الضيقة المزمنة .,part verb prep noun noun adj punc,7
109,Rabat,عندي تقريباً تلاتة آلاف دولار.,عندي تقريباً تلاتة آلاف دولار .,prep adv noun_num noun noun punc,6
111,Rabat,واخا، أسيدي. كا يجي معا فريت أو الروز. إينا واحد تبغي؟,واخا ، أسيدي . كا يجي معا فريت أو الروز . إينا واحد تبغي ؟,part punc noun punc part verb prep noun conj noun punc pron_interrog noun verb punc,15
112,Rabat,كيفاش نقدر نمشي لهاد لبلاصة؟,كيفاش نقدر نمشي لهاد لبلاصة ؟,adv_interrog verb verb pron_dem noun punc,6
113,Rabat,إينا نوع ديال القصة هذا؟,إينا نوع ديال القصة هذا ؟,pron_interrog noun prep noun pron_dem punc,6
115,Rabat,تلاتة ديال المرات.,تلاتة ديال المرات .,noun_num prep noun punc,4
116,Rabat,إينا شرجم كاي بيع التنابر؟,إينا شرجم كاي بيع التنابر ؟,pron_interrog noun part verb noun punc,6
117,Rabat,من بعد ما هجم عليا، هرب في سيارة بيضا.,من بعد ما هجم عليا ، هرب في سيارة بيضا .,prep noun conj_sub verb prep punc verb prep noun adj punc,11
119,Rabat,واخا. خلي عندك هاد البطاقة و قدمها منين تبغي تجي تديه.,واخا . خلي عندك هاد البطاقة و قدمها منين تبغي تجي تديه .,interj punc verb prep pron_dem noun conj verb conj_sub verb verb verb punc,13
120,Rabat,كون كنت فبلاصتك كون شريتو.,كون كنت فبلاصتك كون شريتو .,conj_sub verb noun conj_sub verb punc,6
122,Rabat,ألفين دولار. فلوس ولا بطاقة بنكية؟,ألفين دولار . فلوس ولا بطاقة بنكية ؟,noun_num noun punc noun conj noun adj punc,8
125,Rabat,بشحال الركبة فداك الضاية؟,بشحال الركبة فداك الضاية ؟,adv_interrog noun noun noun punc,5
128,Rabat,واش خصني نتجنب شي نوع ديال الماكلة فاش ناكل هاد الدوا؟,واش خصني نتجنب شي نوع ديال الماكلة فاش ناكل هاد الدوا ؟,part_interrog verb verb noun noun prep noun adv_interrog verb noun noun punc,12
129,Rabat,واش غادي نلقا شي صعوبة مع الديوانا؟,واش غادي نلقا شي صعوبة مع الديوانا ؟,part_interrog verb_pseudo verb noun noun prep noun punc,8
130,Rabat,واش عندك صبابط رسمية واسعة عند الصبع؟,واش عندك صبابط رسمية واسعة عند الصبع ؟,part_interrog prep noun adj adj prep noun punc,8
131,Rabat,ممكن تعطيني شي مشروب؟,ممكن تعطيني شي مشروب ؟,adv verb noun noun punc,5
133,Rabat,منين نوصلو للمتحف قولها ليا.,منين نوصلو للمتحف قولها ليا .,conj_sub verb noun verb prep punc,6
134,Rabat,واش هاد الطوبيس كايمشي لأوطيل الشيراطون؟,واش هاد الطوبيس كايمشي لأوطيل الشيراطون ؟,part_interrog pron_dem noun verb noun noun_prop punc,7
135,Rabat,شنو كاي عني داكشي؟,شنو كاي عني داكشي ؟,part_interrog part verb noun punc,5
136,Rabat,كاين الصهد شوية. واش نقدر نحل الشرجم؟,كاين الصهد شوية . واش نقدر نحل الشرجم ؟,verb noun noun punc part_interrog verb verb noun punc,9
138,Rabat,غير الدوش ماشي مشكل.,غير الدوش ماشي مشكل .,prep noun adj noun punc,5
139,Rabat,عيني حمرين بزاف.,عيني حمرين بزاف .,noun adj adv punc,4
140,Rabat,لا. نقدر نقتارح ثنائية لواحد؟ عندنا وحدة.,لا . نقدر نقتارح ثنائية لواحد ؟ عندنا وحدة .,part_neg punc verb verb noun noun punc prep adj punc,10
142,Rabat,منقدرش نضمن هادشي، ولكن غادي نديرو جهدنا.,منقدرش نضمن هادشي ، ولكن غادي نديرو جهدنا .,verb verb noun punc conj verb_pseudo verb noun punc,9
143,Rabat,بيرمانونت مجهد، عافاك.,بيرمانونت مجهد ، عافاك .,noun adj punc interj punc,5
144,Rabat,البحر كان كاي بان لتحت .,البحر كان كاي بان لتحت .,noun verb part verb prep punc,6
145,Rabat,بغات بيرا.,بغات بيرا .,verb noun punc,3
146,Rabat,خاصك عملية.,خاصك عملية .,adj noun punc,3
147,Rabat,زيدني البيض، عفاك.,زيدني البيض ، عفاك .,verb noun punc interj punc,5
148,Rabat,فين هيا محطة الطوبيس ديال سنطرال بارك؟,فين هيا محطة الطوبيس ديال سنطرال بارك ؟,adv_interrog pron noun noun prep noun_prop noun_prop punc,8
149,Rabat,طاكسي؟,طاكسي ؟,noun punc,2
151,Rabat,ها هو الساروت ديالك أسيدي. الغرفة خمسالاف و ستميا و طناش.,ها هو الساروت ديالك أسيدي . الغرفة خمسالاف و ستميا و طناش .,pron_dem pron noun noun noun punc noun noun_num conj noun_num conj noun_num punc,13
153,Rabat,عجبني التريكو ديالك.,عجبني التريكو ديالك .,verb noun noun punc,4
154,Rabat,تفضل.,تفضل .,verb punc,2
