sentence_id,dialect,sentence,tokens,pos_tags,token_count
155,Rabat,ها حنا وصلنا. ها هو الأوطيل ديالك.,ها حنا وصلنا . ها هو الأوطيل ديالك .,pron_dem pron verb punc pron_dem pron noun prep punc,9
156,Rabat,وقتاش الماتش ديال الباسكيط؟,وقتاش الماتش ديال الباسكيط ؟,adv_interrog noun prep noun punc,5
157,Rabat,صباح الخير. كي داير؟,صباح الخير . كي داير ؟,noun noun punc adv_interrog adj punc,6
158,Rabat,سمح ليا خصني نشوف شي وثيقة ديال الهوية.,سمح ليا خصني نشوف شي وثيقة ديال الهوية .,verb prep verb verb noun noun prep noun punc,9
159,Rabat,شنو كان الإنطباع ديالك؟,شنو كان الإنطباع ديالك ؟,adv_interrog verb noun noun punc,5
160,Rabat,معلوم. تبغي القهوة ديالك معا العشا ولا من بعد؟,معلوم . تبغي القهوة ديالك معا العشا ولا من بعد ؟,interj punc verb noun noun prep noun conj prep noun punc,11
161,Rabat,غادي ناخد الرحلة طناش لطوكيو.,غادي ناخد الرحلة طناش لطوكيو .,verb_pseudo verb noun noun_num noun_prop punc,6
162,Rabat,بغيت ندير مكالمة بعيدة، عفاك.,بغيت ندير مكالمة بعيدة ، عفاك .,verb verb noun adj punc interj punc,7
0,Tunis,موجود في اخر الكولوار. و نجيبهولك توا. كان تستحق حاجة اخرى، قلي.,موجود في اخر الكولوار . و نجيبهولك توا . كان تستحق حاجة اخرى ، قلي .,adj prep adj_comp noun punc conj verb adv punc conj_sub verb noun adj punc verb punc,16
2,Tunis,تعملوا تبديلات؟,تعملوا تبديلات ؟,verb noun punc,3
4,Tunis,نحبوا طاولة قريبة مالشباك.,نحبوا طاولة قريبة مالشباك .,verb noun adj noun punc,5
5,Tunis,اهوكا غادي، بالضبط قدام البيرو متاع الارشادات السياحية.,اهوكا غادي ، بالضبط قدام البيرو متاع الارشادات السياحية .,pron_dem verb_pseudo punc adv prep noun noun noun adj punc,10
9,Tunis,عمري ما سمعت بالادريسة هاذي هوني.,عمري ما سمعت بالادريسة هاذي هوني .,noun part_neg verb noun pron_dem adv punc,7
11,Tunis,امشي طول طول حتى لين تشوف صيدلية.,امشي طول طول حتى لين تشوف صيدلية .,verb adv adv conj_sub conj_sub verb noun punc,8
12,Tunis,شنوة اجد لون الفصل هذا؟,شنوة اجد لون الفصل هذا ؟,pron_interrog adj noun noun pron_dem punc,6
14,Tunis,في الحالة متاعي انا، الكثرية للخدمة، و ساعات للتفرهيد.,في الحالة متاعي انا ، الكثرية للخدمة ، و ساعات للتفرهيد .,prep noun noun pron punc adj noun punc conj noun noun punc,12
15,Tunis,بش نقعد نهارين.,بش نقعد نهارين .,part_fut verb noun punc,4
16,Tunis,نحب برمانونت قوي.,نحب برمانونت قوي .,verb noun adj punc,4
17,Tunis,نحب نحجز زوز بيوت بزوز فروشات.,نحب نحجز زوز بيوت بزوز فروشات .,verb verb noun_num noun noun_num noun punc,7
18,Tunis,ما نحبوش يتجبد.,ما نحبوش يتجبد .,part_neg verb verb punc,4
19,Tunis,الكار هاذي تاقف في شارع ستونر؟,الكار هاذي تاقف في شارع ستونر ؟,noun pron_dem verb prep noun noun_prop punc,7
24,Tunis,عيشك حل فمك بالقدا.,عيشك حل فمك بالقدا .,noun verb noun noun punc,5
26,Tunis,بقداش فطور الصباح؟,بقداش فطور الصباح ؟,adv_interrog noun noun punc,4
27,Tunis,كيفاش انجم نعاونك؟,كيفاش انجم نعاونك ؟,adv_interrog verb verb punc,4
29,Tunis,هيا نمشيو ناكلوا قدمة.,هيا نمشيو ناكلوا قدمة .,interj verb verb noun punc,5
30,Tunis,دور الدورة الثالثة عاليسار.,دور الدورة الثالثة عاليسار .,verb noun adj noun punc,5
31,Tunis,ميسالش تنضف الحوايج هاذوما؟,ميسالش تنضف الحوايج هاذوما ؟,part verb noun pron_dem punc,5
37,Tunis,نعطيك نومرو التاليفون و الادريسة هاذوما.,نعطيك نومرو التاليفون و الادريسة هاذوما .,verb noun noun conj noun pron_dem punc,7
38,Tunis,خلصت الماكلة و الوتيل بالمسبق.,خلصت الماكلة و الوتيل بالمسبق .,verb noun conj noun adj punc,6
40,Tunis,نلوج في مشوى باهي و هادي. تنجم توريني وين عالخريطة هاذي؟,نلوج في مشوى باهي و هادي . تنجم توريني وين عالخريطة هاذي ؟,verb prep noun adj conj adj punc verb verb adv_interrog noun pron_dem punc,13
42,Tunis,الي يكسر حاجة يشريها.,الي يكسر حاجة يشريها .,pron_rel verb noun verb punc,5
46,Tunis,تو نقلها تكلمك دوب ما تروح.,تو نقلها تكلمك دوب ما تروح .,part_fut verb verb conj_sub conj_sub verb punc,7
50,Tunis,تحب كريمة و سكر في قهوتك؟,تحب كريمة و سكر في قهوتك ؟,verb noun conj noun prep noun punc,7
51,Tunis,جروحها خطيرة.,جروحها خطيرة .,noun adj punc,3
52,Tunis,نحب بريكية.,نحب بريكية .,verb noun punc,3
53,Tunis,الوتيل هذا فيه تجهيزات لكونفرونس؟,الوتيل هذا فيه تجهيزات لكونفرونس ؟,noun pron_dem noun noun noun punc,6
56,Tunis,ميسالش نعملو تحريشة و برا؟,ميسالش نعملو تحريشة و برا ؟,interj verb noun conj noun punc,6
57,Tunis,نكلم فيك مالمطار. نوصل لغادي مع الاربعة.,نكلم فيك مالمطار . نوصل لغادي مع الاربعة .,verb prep noun punc verb adv prep noun_num punc,9
62,Tunis,منين نحول لشيكاغو؟,منين نحول لشيكاغو ؟,adv_interrog verb noun_prop punc,4
63,Tunis,بقداش جواب مصوقر لفرانسا؟,بقداش جواب مصوقر لفرانسا ؟,adv_interrog noun adj noun_prop punc,5
64,Tunis,تنجم تصبلي ها الشاك بميتين دولار متاعي؟,تنجم تصبلي ها الشاك بميتين دولار متاعي ؟,verb verb pron_dem noun noun_num noun noun punc,8
68,Tunis,فما فرق كبير كيف تسوق عاليمين.,فما فرق كبير كيف تسوق عاليمين .,part noun adj adv_rel verb noun punc,7
69,Tunis,الممثل هذا طيارة بالحق.,الممثل هذا طيارة بالحق .,noun pron_dem noun adv punc,5
72,Tunis,وينو الجزء متاع الكتب اللي ميش ادبية؟,وينو الجزء متاع الكتب اللي ميش ادبية ؟,adv_interrog noun noun noun pron_rel part_neg adj punc,8
74,Tunis,لو لازم يضهر، كلمني عيشك.,لو لازم يضهر ، كلمني عيشك .,conj_sub verb verb punc verb noun punc,7
78,Tunis,ممكن تبدللي بقعتي؟,ممكن تبدللي بقعتي ؟,adj verb noun punc,4
79,Tunis,فما قارانطي؟,فما قارانطي ؟,part noun punc,3
83,Tunis,سامحني، تو نتلهى بالكلب.,سامحني ، تو نتلهى بالكلب .,verb punc part_fut verb noun punc,6
84,Tunis,اعطيني زوز تساكر متاع قطاطس، للخميس هذا.,اعطيني زوز تساكر متاع قطاطس ، للخميس هذا .,verb noun_num noun noun noun_prop punc noun pron_dem punc,9
86,Tunis,ويني القهوة؟,ويني القهوة ؟,adv_interrog noun punc,3
87,Tunis,نحب مريول متاع صغار.,نحب مريول متاع صغار .,verb noun noun noun punc,5
89,Tunis,تنجم تعاودلي اسمك؟,تنجم تعاودلي اسمك ؟,verb verb noun punc,4
90,Tunis,سي براون موجود؟,سي براون موجود ؟,abbrev noun_prop adj punc,4
91,Tunis,باهي. مراسلة عادية بخمسة و ثمانين سنت وزايدة تلاثة دولارات بالضبط للمراسلة اللي من النوع لبخاص.,باهي . مراسلة عادية بخمسة و ثمانين سنت وزايدة تلاثة دولارات بالضبط للمراسلة من النوع لبخاص .,interj punc noun adj noun_num conj noun_num noun adj noun_num noun adv noun prep noun adj punc,17
92,Tunis,انجم نكري بطو على نهار؟,انجم نكري بطو على نهار ؟,verb verb noun prep noun punc,6
93,Tunis,في انا شباك انجم نعمل حجز؟,في انا شباك انجم نعمل حجز ؟,prep pron noun verb verb noun punc,7
94,Tunis,شنوة هاذاكا؟,شنوة هاذاكا ؟,pron_interrog pron_dem punc,3
96,Tunis,تقلي كيفاش نمشي للاوبرا يعيشك؟,تقلي كيفاش نمشي للاوبرا يعيشك ؟,verb adv_interrog verb noun_prop interj punc,6
97,Tunis,موش كاينك سكرت شوية البارح، يا عزيزي؟,موش كاينك سكرت شوية البارح ، يا عزيزي ؟,part_neg verb verb noun noun punc part_voc adj punc,9
98,Tunis,عيشكم تبعو تعليمات الموضفين متاعنا.,عيشكم تبعو تعليمات الموضفين متاعنا .,noun verb noun noun noun punc,6
100,Tunis,فما حانوت شامل قريب من هنا؟,فما حانوت شامل قريب من هنا ؟,part noun adj adj prep adv punc,7
102,Tunis,عبيهولي للفم، عيشك.,عبيهولي للفم ، عيشك .,verb noun punc interj punc,5
103,Tunis,فما بيت ارخص؟,فما بيت ارخص ؟,part noun adj punc,4
104,Tunis,نفضل كرهبة اوتوماتيك.,نفضل كرهبة اوتوماتيك .,verb noun adj punc,4
105,Tunis,باش نقعد في مبيت جامعة هارفارد.,باش نقعد في مبيت جامعة هارفارد .,part verb prep noun noun noun_prop punc,7
106,Tunis,شنية القيمة اليوم؟,شنية القيمة اليوم ؟,pron_interrog noun noun punc,4
108,Tunis,مريض بضيق النفس المزمن.,مريض بضيق النفس المزمن .,adj noun noun adj punc,5
109,Tunis,عندي تقريبا تلاثة لاف دولار.,عندي تقريبا تلاثة لاف دولار .,prep adv noun_num noun_num noun punc,6
111,Tunis,باهي، يا سيدي. نحطلك معاه فريت ولا روز. شنوة تحب؟,باهي ، يا سيدي . نحطلك معاه فريت ولا روز . شنوة تحب ؟,interj punc part_voc noun punc verb prep noun conj noun punc pron_interrog verb punc,14
112,Tunis,كيفاش نمشي للبلاصة هاذي؟,كيفاش نمشي للبلاصة هاذي ؟,adv_interrog verb noun pron_dem punc,5
113,Tunis,شنية نوعها القصة هاذي؟,شنية نوعها القصة هاذي ؟,pron_interrog noun noun pron_dem punc,5
115,Tunis,تلاثة مرات.,تلاثة مرات .,noun_num noun punc,3
116,Tunis,انا هو الشباك اللي يبيع التنابر؟,انا هو الشباك اللي يبيع التنابر ؟,pron pron noun pron_rel verb noun punc,7
117,Tunis,بعد ما هجم علي، هرب في كميونة بيضة.,بعد ما هجم علي ، هرب في كميونة بيضة .,noun conj_sub verb prep punc verb prep noun adj punc,10
119,Tunis,باهي. خلي عندك التيكة هاذي و جيبها معاك كيف تجي بش تهزو.,باهي . خلي عندك التيكة هاذي و جيبها معاك كيف تجي بش تهزو .,interj punc verb prep noun pron_dem conj verb prep conj_sub verb conj_sub verb punc,14
120,Tunis,انا في بلاصتك نشريه.,انا في بلاصتك نشريه .,pron prep noun verb punc,5
122,Tunis,ميتين دولار. فلوس ولا كارطة؟,ميتين دولار . فلوس ولا كارطة ؟,noun_num noun punc noun conj noun punc,7
125,Tunis,قداش يلزم وقت عبور هاذي البركة؟,قداش يلزم وقت عبور هاذي البركة ؟,adv_interrog verb noun noun pron_dem noun punc,7
128,Tunis,فما ماكلة ما يلزمش ناكلها و انا نشرب في الدواء هذا؟,فما ماكلة ما يلزمش ناكلها و انا نشرب في الدواء هذا ؟,part noun part_neg verb verb conj pron verb prep noun pron_dem punc,12
129,Tunis,باش نلقى مشكلة مع الديوانة؟,باش نلقى مشكلة مع الديوانة ؟,part verb noun prep noun punc,6
130,Tunis,تبيعو صبابط رسمية يكونو واسعين من شيرة الصوابع؟,تبيعو صبابط رسمية يكونو واسعين من شيرة الصوابع ؟,verb noun adj verb adj prep noun noun punc,9
131,Tunis,من فضلك شوية شراب احمر؟,من فضلك شوية شراب احمر ؟,prep noun noun noun adj punc,6
133,Tunis,قلي كيف نوصلو للمتحف.,قلي كيف نوصلو للمتحف .,verb adv_interrog verb noun punc,5
134,Tunis,الكار هاذي تمشي لوتيل الشيراتون؟,الكار هاذي تمشي لوتيل الشيراتون ؟,noun pron_dem verb noun noun_prop punc,6
135,Tunis,قداش يطلعو؟,قداش يطلعو ؟,adv_interrog verb punc,3
136,Tunis,الدنية سخونة شوية. ميسالش نحل الشباك؟,الدنية سخونة شوية . ميسالش نحل الشباك ؟,noun adj noun punc part verb noun punc,8
138,Tunis,دوش يزي.,دوش يزي .,noun verb punc,3
139,Tunis,عينيا حمر.,عينيا حمر .,noun adj punc,3
140,Tunis,لا. تحب بيت فيها زوز فروشات نحسبوها لشخص برك؟ عنا وحدة.,لا . تحب بيت فيها زوز فروشات نحسبوها لشخص برك ؟ عنا وحدة .,part_neg punc verb noun prep noun_num noun verb noun adv punc prep noun punc,14
142,Tunis,ما انجمش نضمنلك، اما تو نعملو اللي انجمو.,ما انجمش نضمنلك ، اما تو نعملو اللي انجمو .,part_neg verb verb punc conj adv verb pron_rel verb punc,10
143,Tunis,نحب برمانونت قوية، عيشك.,نحب برمانونت قوية ، عيشك .,verb noun adj punc noun punc,6
144,Tunis,البحر كان يترا من بعيد تحتنا.,البحر كان يترا من بعيد تحتنا .,noun verb_pseudo verb prep adj prep punc,7
145,Tunis,تحب كعبة بيرا.,تحب كعبة بيرا .,verb noun noun punc,4
146,Tunis,يلزمك عملية.,يلزمك عملية .,verb noun punc,3
147,Tunis,زيدني عضم، عيشك.,زيدني عضم ، عيشك .,verb noun punc interj punc,5
148,Tunis,ويني محطة الكيران اللي تهز لسونترال بارك؟,ويني محطة الكيران اللي تهز لسونترال بارك ؟,adv_interrog noun noun pron_rel verb noun_prop noun_prop punc,8
149,Tunis,تكسيات؟,تكسيات ؟,noun punc,2
151,Tunis,تفضل مفتاحك، سيدي. بيت ستة و خمسين اثناش.,تفضل مفتاحك ، سيدي . بيت ستة و خمسين اثناش .,verb noun punc noun punc noun noun_num conj noun_num noun_num punc,11
153,Tunis,محلاه مريولك.,محلاه مريولك .,interj noun punc,3
154,Tunis,تفضل.,تفضل .,verb punc,2
155,Tunis,وصلنا. هذا الوتيل متاعك.,وصلنا . هذا الوتيل متاعك .,verb punc pron_dem noun prep punc,6
156,Tunis,وقتاش يبدا طرح الباسكات؟,وقتاش يبدا طرح الباسكات ؟,adv_interrog verb noun noun punc,5
157,Tunis,صباح الخير. لاباس؟,صباح الخير . لاباس ؟,noun noun punc adj punc,5
158,Tunis,سامحني لازمني نشوف اوراقك.,سامحني لازمني نشوف اوراقك .,verb verb verb noun punc,5
159,Tunis,شنوة كان انطباعك؟,شنوة كان انطباعك ؟,part_interrog verb_pseudo noun punc,4
160,Tunis,بالطبيعة. تحب قهوتك مع العشاء ولا بعد؟,بالطبيعة . تحب قهوتك مع العشاء ولا بعد ؟,noun punc verb noun prep noun conj noun punc,9
161,Tunis,باش نسافر في الرحلة اثناش لطوكيو.,باش نسافر في الرحلة اثناش لطوكيو .,part verb prep noun noun_num noun_prop punc,7
162,Tunis,نحب نعمل تلفون للخارج، عيشك.,نحب نعمل تلفون للخارج ، عيشك .,verb verb noun noun punc interj punc,7
5,Jerusalem,هناك، قدام مكتب استعلامات السياح بالزبط.,هناك ، قدام مكتب استعلامات السياح بالزبط .,adv punc prep noun noun noun adv punc,8
9,Jerusalem,عمري ما سمعت هدا العنوان هون.,عمري ما سمعت هدا العنوان هون .,noun part_neg verb pron_dem noun adv punc,7
11,Jerusalem,خليك ماشي دغري لتلاقي صيدلية.,خليك ماشي دغري لتلاقي صيدلية .,verb adv adv verb noun punc,6
26,Jerusalem,قديش الفطور؟,قديش الفطور ؟,adv_interrog noun punc,3
27,Jerusalem,كيف بقدر أساعدك؟,كيف بقدر أساعدك ؟,adv_interrog verb verb punc,4
30,Jerusalem,روح شمال عند الكورنر التالتة.,روح شمال عند الكورنر التالتة .,verb adv prep noun adj punc,6
50,Jerusalem,بتحب السكر و الكريمة مع قهوتك؟,بتحب السكر و الكريمة مع قهوتك ؟,verb noun conj noun prep noun punc,7
64,Jerusalem,بتقدر تصرفلي شك الميتين دولار تبعي؟,بتقدر تصرفلي شك الميتين دولار تبعي ؟,verb verb noun noun_num noun noun punc,7
74,Jerusalem,ازا لازم يظهر، احكي معي.,ازا لازم يظهر ، احكي معي .,conj_sub adv verb punc verb prep punc,7
86,Jerusalem,وين الكوفي شوب؟,وين الكوفي شوب ؟,adv_interrog noun noun punc,4
87,Jerusalem,بدي جرزة أطفال.,بدي جرزة أطفال .,verb noun noun punc,4
91,Jerusalem,طيب. بتكلف خمسة و تمانين سنت للبريد العادي و تلات دولارات بالزبط اضافية للتوصيل الخاص.,طيب . بتكلف خمسة و تمانين سنت للبريد العادي و تلات دولارات بالزبط اضافية للتوصيل الخاص .,interj punc verb noun_num conj noun_num noun noun adj conj noun_num noun adv adj noun adj punc,17
120,Jerusalem,لو كنت مكانك بشتريه.,لو كنت مكانك بشتريه .,conj_sub verb noun verb punc,5
129,Jerusalem,رح ألاقي صعوبات في الجمارك؟,رح ألاقي صعوبات في الجمارك ؟,part_fut verb noun prep noun punc,6
130,Jerusalem,في عندك كندرة رسمي عريضة؟,في عندك كندرة رسمي عريضة ؟,part prep noun adj adj punc,6
140,Jerusalem,لأ. تاخد غرفة بتختين لاستعمال واحد؟ في عنا واحدة.,لأ . تاخد غرفة بتختين لاستعمال واحد ؟ في عنا واحدة .,part_neg punc verb noun noun noun noun_num punc prep prep noun_num punc,12
143,Jerusalem,بدي كيرلي صغير، لو سمحت.,بدي كيرلي صغير ، لو سمحت .,verb noun adj punc conj_sub verb punc,7
145,Jerusalem,بدها بيرة.,بدها بيرة .,verb noun punc,3
157,Jerusalem,صباح الخير. كيف حالك؟,صباح الخير . كيف حالك ؟,noun noun punc adv_interrog noun punc,6
158,Jerusalem,متأسف محتاج اني أشوف بطاقة الهوية.,متأسف محتاج اني أشوف بطاقة الهوية .,adj adj conj_sub verb noun noun punc,7
169,Jerusalem,شو نوع الصوص؟,شو نوع الصوص ؟,pron_interrog noun noun punc,4
170,Jerusalem,هدا بارد شوي. بتقدر تسخنه؟,هدا بارد شوي . بتقدر تسخنه ؟,pron_dem adj adv punc verb verb punc,7
173,Jerusalem,متأسف، هدا المكان محجوز.,متأسف ، هدا المكان محجوز .,adj punc pron_dem noun adj punc,6
176,Jerusalem,أنا منيح. بس بتقدر تكلملي صاحبي؟,أنا منيح . بس بتقدر تكلملي صاحبي ؟,pron adj punc adv verb verb noun punc,8
177,Jerusalem,شكرا، هيك بكفي.,شكرا ، هيك بكفي .,interj punc adv verb punc,5
184,Jerusalem,مين صاحبك المفضل؟,مين صاحبك المفضل ؟,pron_interrog noun adj punc,4
187,Jerusalem,يوم الصحة و الرياضة العالمي في العاشر من اكتوبر هو يوم وطني مخصص للتوعية بصحة الناس.,يوم الصحة و الرياضة العالمي في العاشر من اكتوبر هو يوم وطني مخصص للتوعية بصحة الناس .,noun noun conj noun adj prep adj prep noun_prop pron noun adj adj noun noun noun punc,17
192,Jerusalem,بدك ياني أفحص تحت غطا السيارة؟,بدك ياني أفحص تحت غطا السيارة ؟,verb pron verb noun noun noun punc,7
206,Jerusalem,بتقدر تساعدني ألاقي شنتتي؟,بتقدر تساعدني ألاقي شنتتي ؟,verb verb verb noun punc,5
221,Jerusalem,بتعمل الترتيبات قبل بوقت؟,بتعمل الترتيبات قبل بوقت ؟,verb noun noun noun punc,5
238,Jerusalem,عم بساعدوني. شكرا الك.,باش بساعدوني . شكرا الك .,part verb punc interj prep punc,6
261,Jerusalem,لما توصل هناك، اسأل حدا تاني، لو سمحت.,لما توصل هناك ، اسأل حدا تاني ، لو سمحت .,conj_sub verb adv punc verb noun adj punc conj_sub verb punc,11
280,Jerusalem,بدي التحويلة رقم أربعة و عشرين، لو سمحت.,بدي التحويلة رقم أربعة و عشرين ، لو سمحت .,verb noun noun noun_num conj noun_num punc conj_sub verb punc,10
285,Jerusalem,هي دولارين. خلي الباقي معك.,هي دولارين . خلي الباقي معك .,pron noun punc verb noun prep punc,7
315,Jerusalem,واحد هامبرغر وواحد برغر مع جبنة، لو سمحت.,واحد هامبرغر وواحد برغر مع جبنة ، لو سمحت .,noun_num noun noun_num noun prep noun punc conj_sub verb punc,10
319,Jerusalem,قديش بتاخد على العملية؟,قديش بتاخد على العملية ؟,adv_interrog verb prep noun punc,5
320,Jerusalem,كل واحد فينا بدو يدفع عن وجبتو.,كل واحد فينا بدو يدفع عن وجبتو .,part noun prep verb verb prep noun punc,8
326,Jerusalem,الموقع كان على كرسي في اللوبي.,الموقع كان على كرسي في اللوبي .,noun verb_pseudo prep noun prep noun punc,7
333,Jerusalem,لو سمحت اصرفلي الين لجنيهات.,لو سمحت اصرفلي الين لجنيهات .,conj_sub verb verb noun noun punc,6
346,Jerusalem,بدي قاموس جيبة، لو سمحت.,بدي قاموس جيبة ، لو سمحت .,verb noun noun punc conj_sub verb punc,7
360,Jerusalem,لشخصين على الساعة سبعة. باسم واتانبي.,لشخصين على الساعة سبعة . باسم واتانبي .,noun prep noun noun_num punc noun noun_prop punc,8
368,Jerusalem,ساعتي. نوعها سيكو و ديجيتال.,ساعتي . نوعها سيكو و ديجيتال .,noun punc noun noun_prop conj adj punc,7
370,Jerusalem,بنتشرف انا نعطيك مشروب من زوقك، وبعدو العشا. دليل كامل للمشروبات يلي بنقدمها على هاي الرحلة موجود في دليل المعلومات في مجلتنا.,بنتشرف انا نعطيك مشروب من زوقك ، وبعدو العشا . دليل كامل للمشروبات يلي بنقدمها على هاي الرحلة موجود في دليل المعلومات في مجلتنا .,verb pron verb noun prep noun punc conj noun punc noun adj noun pron_rel verb prep pron_dem noun adj prep noun noun prep noun punc,25
373,Jerusalem,انت ساكن هون؟,انت ساكن هون ؟,pron adj adv punc,4
375,Jerusalem,وين محل الهدايا؟,وين محل الهدايا ؟,adv_interrog noun noun punc,4
386,Jerusalem,أنا على أوتوستراد رقم واحد جنب خليج مورو.,أنا على أوتوستراد رقم واحد جنب خليج مورو .,pron prep noun noun noun_num prep noun noun_prop punc,9
391,Jerusalem,بدي منبه، لو سمحت.,بدي منبه ، لو سمحت .,verb noun punc conj_sub verb punc,6
398,Jerusalem,على فكرة، اسمي هيروشي ايجيما.,على فكرة ، اسمي هيروشي ايجيما .,prep noun punc noun noun_prop noun_prop punc,7
401,Jerusalem,هدا القطار بوقف عند ليك فوريست، صح؟,هدا القطار بوقف عند ليك فوريست ، صح ؟,pron_dem noun verb prep noun_prop noun_prop punc adj punc,9
408,Jerusalem,أغلب اليابانيين بياكلو الأخطبوط و الحبار.,أغلب اليابانيين بياكلو الأخطبوط و الحبار .,adj noun verb noun conj noun punc,7
416,Jerusalem,بقدر أحجز تزكرتين درجة تانية لشيكاغو، لو سحمت؟,بقدر أحجز تزكرتين درجة تانية لشيكاغو ، لو سحمت ؟,verb verb noun noun adj noun_prop punc conj_sub verb punc,10
419,Jerusalem,رحت على نيو يورك.,رحت على نيو يورك .,verb prep noun_prop noun_prop punc,5
423,Jerusalem,شو رقم الرحلة؟,شو رقم الرحلة ؟,part_interrog noun noun punc,4
442,Jerusalem,وحدة لنيو يورك، لو سمحت.,وحدة لنيو يورك ، لو سمحت .,noun noun_prop noun_prop punc conj_sub verb punc,7
446,Jerusalem,لأكم من يوم.,لأكم من يوم .,adv_interrog prep noun punc,4
447,Jerusalem,التاني على الشمال.,التاني على الشمال .,adj prep noun punc,4
